id,type,sub_type,name,description,year,lat,long,evacuated,homeless,injuries,deaths,insured_cost,homes_damaged,homes_destroyed,regions,url,severity,normalised_cost_2011,cost_2011_text
506,Natural,Storm/Hail,"Melbourne, 2010","On 6 March 2010, thunderstorms occurred in the west of Victoria, intensifying as they moved eastward towards the Shepparton region. The same day, severe thunderstorms also developed into the north-west of metropolitan Melbourne, bringing isolated severe wind gusts.  Flash flooding was widespread across the city and hailstones measuring 2 - 10 cm caused damage to homes and major buildings including the Arts Centre, Etihad Stadium and Southern Cross Station.  Shepparton experienced localised flooding, hail and wind damage prior to the storm moving south. Power outages occurred to 100,000 homes in Melbourne and 45,000 homes in the Shepparton region.  The severe thunderstorms resulted in more than 7500 calls to the Victorian State Emergency Service, prompting crews from New South Wales, South Australia, Western Australia and Tasmania to help in the clean up.  Financial assistance for affected communities was announced by the Federal Attorney-General on 12 March 2010.  The Insurance Council of Australia estimated the 2010 damage at $1044 million, with the 2011 estimated normalised cost of $1160 million.",2010,-37.81795502,144.95361330,0,0,0,0,"$1,044,000,000.00",0,0,VIC,http://www.emknowledge.gov.au/resource/?id=506,"$1,160,000,000.00","$1,160,000,000.00","$1,160m"
509,Natural,Storm/Hail,"Perth, 2010","Severe thunderstorms occurred on the afternoon and evening of Monday 22 March 2010 in the central west, lower west, and adjacent parts of the south-west great southern and central wheat belt districts of Western Australia. Severe storms moved through Perth between 3.30 pm and 6 pm with large hail at record levels, heavy rain and severe winds that resulted in considerable damage.  The storm was responsible for record numbers of power outages more than 150,000 properties were without power at the peak, 300 hazard incidents and affected flight, train and bus services. The number of requests for assistance from FESA and SES totalled more than 3000, the most significant number since the May 1994 wind storms. Approximately 15 schools in the northern suburbs were closed the following day due to damage, while many hospitals were also damaged.  Large hail occurred in a strip from the northern coastal suburbs to south Perth. For many suburbs, particularly from Osborne Park to Crawley, hail from 4-6 cm was large enough to badly damage cars, break car windscreens and windows of houses. Hail blocked gutters and drains worsening the impacts of flooding. Many properties were inundated with water including the University of Western Australia's library. A landslip at Kings Park caused the evacuation of several apartment towers as mud inundated lower levels threatening their stability.  The Insurance Council of Australia estimated the 2010 damage at $1053 million with the 2011 estimated normalised cost at $1019 million.",2010,-31.90671539,115.81361390,100,0,0,0,"$1,053,000,000.00",0,0,WA,http://www.emknowledge.gov.au/resource/?id=509,"$1,029,000,000.00","$1,019,000,000.00","$1,019m"
520,Natural,Storm/Hail,Dubbo,"On 6 January 2001 areas of Dubbo (Central Western Slopes) experienced a very severe thunderstorm late in the day. Damage from strong winds, large hailstones and flash flooding occurred. Approximately 50 mm of rain and hail was recorded in around thirty minutes and wind gusts of up to 130 km per hour resulted in hundreds of falling trees. It was estimated 400 buildings and 150 motor vehicles were damaged. Dubbo was declared a natural disaster area.  The Insurance Council of Australia estimated the 2001 damage at $15 million, with the 2011 estimated normalised cost of $28 million.",2001,-32.24010086,148.60983280,0,0,0,0,"$15,000,000.00",0,0,NSW,http://www.emknowledge.gov.au/resource/?id=520,"$28,000,000.00","$28,000,000.00",$28m
522,Natural,Storm/Hail,"Grafton, Kingscliff and Lismore","On 16 January 2002 a severe thunderstorm developed south of Grafton and intensified as it moved north-east toward the coast. Hail and heavy rain were reported at Grafton and Lismore reported damaging winds, flash flooding and hail the size of golf balls. The storm was at its highest intensity as it crossed the coast at Kingscliff. Flash flooding, 7 cm hail and a tornado occurred. Damage was reported at Kingscliff and neighbouring Banora Point.  The Insurance Council of Australia estimated the 2002 damage at $10 million, with the 2011 estimated normalised cost of $36 million.",2002,-29.69006538,152.93312070,0,0,0,0,"$10,000,000.00",0,0,NSW,http://www.emknowledge.gov.au/resource/?id=522,"$36,000,000.00","$36,000,000.00",$36m
547,Natural,Storm/Hail,Northern New South Wales,"On 30 June 2005, a surface trough deepened off the east coast of New South Wales resulting in strong north-easterly winds and flooding rain in the far north-east of the State.  In Tweed Heads a record for June was set with 382 mm of rain recorded to 9:00 am. Several other rainfall stations recorded their highest ever daily rainfall for June including: Mullumbimby, Woodburn, Alstonville, Byron Bay and Murwillumbah.  Record flooding was recorded at Marshalls Creek. The most serious impacts of the floods occurred at Lismore, where hundreds of people were evacuated. Overall, hundreds of homes and businesses were flooded and key infrastructure damaged. Thousands of residents on the Northern Coast were cut off by the flood waters for days and required food and medical drops by boat or helicopter.  One person died in Byron Bay and two in South East Queensland.  The Insurance Council of Australia estimated the 2005 damage at $25 million, with the 2011 estimated normalised cost of $37 million.  This event coincides with a storm in South East Queensland on the same date. The Insurance Council of Australia list two entries, South - East Queensland $53.9 million and North - East New South Wales $25 million.",2005,-28.17330170,153.54298400,0,0,0,1,"$25,000,000.00",0,0,NSW,http://www.emknowledge.gov.au/resource/?id=547,"$40,000,000.00","$37,000,000.00",$37m
548,Natural,Storm/Hail,Coffs Harbour,"In the early evening on 23 November 1996, Coffs Harbour experienced flash flooding from heavy rainfall with up to 300 mm of rain falling in a two hour period. This caused water to rise approximately 1.5 m in the centre of the town, damaging most shops. The severe storm was a result of an off shore low pressure system that was strengthened by the steep ranges of Coffs Harbour.  Coffs Creek flooded, which was intensified by the high tide. One person drowned, having been swept away by the rising flood water.  Approximately 300 people were moved to higher ground due to inundation. Crops were destroyed and mudslides covered the Pacific Highway.  The Insurance Council of Australia estimated the 1996 damage at $20 million, with the 2011 estimated normalised cost of $67 million.",1996,-30.29405403,153.11611940,0,0,0,1,"$20,000,000.00",0,0,NSW,http://www.emknowledge.gov.au/resource/?id=548,"$70,000,000.00","$67,000,000.00",$67m
608,Natural,Storm/Hail,Adelaide,"On 22 January 1991 at 7 pm a damaging hail storm occurred in Adelaide; at the time it was one of the most severe storms on record. Hailstones reached 10 cm in diameter, causing damage to motor vehicles, roof tiles and windows resulting in water damage to many houses.  The Insurance Council of Australia estimated the 1991 damage at $30 million, with the 2011 estimated normalised cost of $112 million.",1991,-34.92872620,138.59994510,0,0,0,0,"$30,000,000.00",0,0,SA,http://www.emknowledge.gov.au/resource/?id=608,"$112,000,000.00","$112,000,000.00",$112m
24,Natural,Storm/Hail,South-East Queensland and Northern New South Wales,"In early October 2007, severe storms brought about heavy rain and caused widespread damage in south-east Queensland and northern New South Wales.  There was damage to roads, bridges, houses and buildings. The State Emergency Services (SES) provided accommodation, household repairs and replacement assistance.  The Insurance Council of Australia estimated the 2007 damage at $97 million, with the 2011 estimated normalised cost of $109 million.",2007,-28.80579758,153.27687070,0,0,0,0,"$97,000,000.00",0,0,QLD,http://www.emknowledge.gov.au/resource/?id=24,"$109,000,000.00","$109,000,000.00",$109m
4165,Natural,Storm/Hail,Sydney Nov 1976,"On 10 November 1976, a severe hailstorm blanketed parts of Western Sydney. The worst affected suburbs were Villawood, Auburn and Lindcome, where hailstones were the size of tennis balls.  Ten people were injured and extensive damage was caused to cars, vehicles and the Auburn swimming centre, where the roof fell into the pool.",1976,-33.86086655,151.02304080,0,0,10,0,"$40,000,000.00",0,0,NSW,http://www.emknowledge.gov.au/resource/?id=4165,"$655,000,000.00","$650,000,000.00",$650m
2118,Natural,Storm/Hail,Perth and Southern Western Australia,"Southern Western Australia experienced a number of widespread storms over a week commencing with a tornado hitting the Perth suburbs of Dianella and Morley on 7 June 2012. The tornado uprooted trees, brought down power lines, and lifted roofs from buildings. Reportedly the tornado only lasted approximately 10 minutes, but the winds up to 125 km per hour caused damage expected to be worth millions of dollars.  A further storm hit 10 June with winds of up to 140 km per hour lashing the south-west. Hundreds of power lines, street light wires and service wires came down in the storm. Some residents were warned they maybe without electricity for up to a week after more than 110,000 homes were affected. The weather bureau described the storm as a 'once in a decade' event.  In Bunbury, cars, buildings and infrastructure were damaged. Residents reported damage to houses, downed power lines, and debris spread across roads.  The State Emergency Service received hundreds of calls for help, mostly for damaged roofs and powerlines.  A man died after falling from a storm damaged roof south of Perth.  On 12 June, a third severe storm hit southern Western Australia in a week. Winds up to 113 km per hour, thunder and heavy rain caused power outages to 34,000 properties throughout the state. The storm hit the Perth metropolitan area at approximately 9.30 pm (AWST), bringing wind gusts of 107 km per hour as well as heavy rain and thunder for most of the night.  The Fire and Emergency Services Authority (FESA) answered more than 118 calls for help.  There was no major damage from the third storm.  Insurance cost will be provided when available.",2012,-31.95048714,115.85700990,0,0,0,1,$0.00,0,0,WA,http://www.emknowledge.gov.au/resource/?id=2118,"$3,000,000.00",$0.00,Not known
505,Natural,Storm/Hail,"Melbourne, February 2011","On 4 February 2011, severe thunderstorms developed over Victoria. Tropical moisture associated with Tropical Cyclone Anthony and ex Tropical Cyclone Yasi interacted with a persistent low pressure trough extending from central Australia, through Mildura and Melbourne, to north-eastern Tasmania.  Extremely high humidity and strong winds were associated with the storms which delivered record daily and multi-day rainfall totals to areas of north-east and south-east Victoria. The rain caused flash flooding in metropolitan Melbourne and prompted flood warnings for 24 rivers and creeks.  On the afternoon and evening of 4 February, a damaging microburst caused damage west of Melbourne at Laverton. Wind speed strengthened from calm to 131 km per hour in six minutes causing damage to vegetation and structures within an area of approximately one square kilometre.  More than 65 per cent of Victoria recorded daily rainfall totals in the 99th percentile for February in the 24 hours to 9 am on February 5. Approximately 7 per cent of the State observed the highest daily rainfall on record on the same day and 40 stations throughout Victoria recorded multi-day rainfall totals over 140 mm between 4 and 6 February.  Nursing home residents were evacuated from Mentone, Narre Warren and Werribee, whilst the Koo Wee Rup and the Alfred hospital relocated patients.  Emergency relief centres were opened in Mildura, Narre Warren, Cardinia, Pakenham and Swan Hill.  State wide, more than 6000 calls were made to the Victorian State Emergency Service.  The Insurance Council of Australia estimated the preliminary 2011 damage at $418.6 million.",2011,-37.81795502,144.95361330,6000,0,1,0,"$418,670,000.00",0,0,VIC,http://www.emknowledge.gov.au/resource/?id=505,"$1,019,170,000.00","$418,670,000.00",$419m
594,Natural,Storm/Hail,"Melbourne, December 2011","A trough of low pressure developed over Victoria on 23 December, deepening further on 25 December, before progressing east on 26 December with a cold frontal push.  On 25 December, thousands of homes were damaged when thunderstorms swept across Melbourne, bringing flash flooding and hail. The State Emergency Service received more than 4200 requests for assistance, most resulting from hail damage, wind damage and flash flooding through the western and northern suburbs of Melbourne.  Severe thunderstorms first developed to the west of Melbourne, south-east of Ballan, at approximately 2.30 pm on Christmas Day. During the next seven hours up to five long-lived supercells (very severe long lasting thunderstorm cells) moved eastwards across the northern suburbs of Melbourne.  The northern Melbourne suburbs of Eltham, Broadmeadows and Keilor were among the worst hit. There were reports of two tornadoes in Fiskville and Melton with some carsbeing upended.  More than 50 volunteers arrived from interstate to help repair damaged homes. The State Government paid 220 emergency relief payments. An information centre was established in Keilor Downs to help residents who experienced storm damage. Representatives from the SES, Department of Human Services, Red Cross and the Salvation Army provided assistance to help residents who experienced storm damage.  The Insurance Council of Australia declared the weather event as a catastrophe. It received up to 30,000 claims for damage to houses, businesses and motor vehicles.  The Insurance Council of Australia estimated the preliminary 2011 damage at $728.6 million.",2011,-37.71207047,145.14862060,0,0,0,0,"$728,640,000.00",0,0,VIC,http://www.emknowledge.gov.au/resource/?id=594,"$728,640,000.00","$728,640,000.00",$729m
404,Natural,Storm/Hail,Lake Grace,"On 16 October 2005, a complex low pressure system moved through the Central Wheatbelt and the Great Southern. Severe thunderstorms associated with the system caused hail damage to crops in the Lake Grace area from approximately 2.30 to 4.30 pm. More than 200 farms were affected. The area covered was 150 km from north to south and 50 km west to east. In most places the hailstorm lasted for approximately one hour and hail measured between 1 cm and 3 cm in diameter. In some places the hail was up to 25 cm deep. Over 5000 hectares of crops were destroyed and another 5500 hectares had at least 30 to 40 per cent damage. Estimates put the cost of the damage at over $10 million.",2005,-33.10052109,118.46662140,0,0,0,0,"$10,000,000.00",0,0,WA,http://www.emknowledge.gov.au/resource/?id=404,"$14,000,000.00","$14,000,000.00",$14m
424,Natural,Storm/Hail,Eastern New South Wales,"On 18 November 2001, severe thunderstorms affected many parts of eastern New South Wales. Most of the impact was felt at Nelson Bay, where thunderstorms and tornadoes occurred with winds reaching up to 150 km per hour. It was reported more than 100 buildings were damaged and several boats destroyed.  Significant damage also occurred in the Lower Hunter Valley and the Sydney metropolitan regions of Penrith, Richmond and Horsley Park from strong wind gusts. Approximately 2000 homes and 200 cars were damaged and three people were killed.  Wisemans Ferry reported hail 3 cm in diameter. More hail similar in size occurred at Bundarra, Ben Lomond (Northern Tablelands), and in Canberra small hail fell in the northern suburbs on the afternoon on 18 November.  The Insurance Council of Australia estimated the 2001 damage at $30 million, with the 2011 estimated normalised cost of $99 million.",2001,-32.72064972,152.14382930,0,0,0,3,"$30,000,000.00",2000,0,NSW,http://www.emknowledge.gov.au/resource/?id=424,"$108,000,000.00","$99,000,000.00",$99m
333,Natural,Storm/Hail,New England and Hunter Valley,"On 17 November 1996 the areas of the Hunter Valley and New England (particularly Tamworth) experienced severe storms, hail and wind damage. Winds up to 111 km per hour felled trees, powerlines and damaged houses, buildings and blocked some roads. The worst affected areas included Tamworth, Werris Creek, Coonabarabran, Baradine, Dungog, Scone, Stroud and Forster with all experiencing varying degrees of storm damage.  The Insurance Council of Australia estimated the 1996 damage at $10 million, with the 2011 estimated normalised cost of $28 million.",1996,-31.09020615,150.93029790,0,0,0,1,"$10,000,000.00",0,0,NSW,http://www.emknowledge.gov.au/resource/?id=333,"$31,000,000.00","$28,000,000.00",$28m
338,Natural,Storm/Hail,Hunter Valley and Mid-North Coast,"On the 30 November 1995, the areas of the Hunter Valley and mid-north coast experienced thunderstorms with high winds. The greatest damage occurred in Maitland, Metford, Thornton and Taree. More than 120 buildings were unroofed or seriously damaged.  The Insurance Council of Australia estimated the 1995 damage at $10 million, with the 2011 estimated normalised cost of $31 million.",1995,-32.76039124,151.60273740,0,0,0,0,"$10,000,000.00",0,0,NSW,http://www.emknowledge.gov.au/resource/?id=338,"$31,000,000.00","$31,000,000.00",$31m
