id,type,sub_type,name,description,year,lat,long,evacuated,homeless,injuries,deaths,insured_cost,homes_damaged,homes_destroyed,regions,url,severity,normalised_cost_2011,cost_2011_text
460,Natural,Storm/Hail,Port Broughton,"On 14 November 1979 Port Broughton sustained damaged by a line of ferocious storms that hit south-eastern South Australia. Very strong winds and hail ruined solid brick houses, holiday shacks and caravans. Cars were pushed sideways along the road. Pine trees up to 30 m tall were uprooted.  There was no loss of life during the event which was considered to be amazing. Eleven people were injured requiring hospital admission, 60 others required hospital treatment.  While Port Broughton incurred the most damage, other areas were also affected by this weather event. Destruction was felt from the mid north to northern Adelaide Plains. Clare experienced severe damage; houses lost their roofs and sheds were demolished in the high winds. Likewise the northern suburbs of Adelaide saw houses unroofed and the trees blown over in areas such Salisbury North, Parafield Gardens, and Munno Para.  The agriculture industry was severely impacted with crops damaged, glass houses broken, grape vines stripped, storage tanks squashed, orchards destroyed and many farmers livelihoods built up over many years were lost within ten minutes.  According to the Bureau of Meteorology Regional Forecasting Centre, the thunderstorm triggered by the trough line that extended across Yorke Peninsula moved over Port Broughton and produced destructive winds. The winds at all levels through the atmosphere were very strong. A thunderstorm is classified as severe if it produces wind gusts of 90 km per hour of more. On this day gusts were much higher with reports of 135 km per hour to 160 km per hour. Isolated large hail coming from very cold air high above the earth's surface was rapidly transported to the surface by downdrafts and accompanied the thunderstorms associated with the trough immediately to the east causing damage to some of Adelaide&rsquo;s northern suburbs.  The Insurance Council of Australia estimated the 1979 damage at $10 million, with the 2011 normalised cost of $92 million.",1979,-33.60050201,137.93331910,0,150,71,0,"$10,000,000.00",0,0,SA,http://www.emknowledge.gov.au/resource/?id=460,"$142,500,000.00","$92,000,000.00",$92m
130,Natural,Storm/Hail,Cape York and Townsville,"On 12 March 1934, a tropical cyclone crossed the north Queensland coast near Cape Tribulation. A storm surge associated with the cyclone at nearby Bailey Creek destroyed crop plantations. Widespread damage and destruction of property occurred at Mossman, Daintree and Cape Tribulation. There were 75 deaths recorded.",1934,-16.07979584,145.46447750,0,0,0,75,$0.00,0,0,QLD,http://www.emknowledge.gov.au/resource/?id=130,"$225,000,000.00",$0.00,Not known
429,Natural,Storm/Hail,Orbost,"On 24 January 1991 a severe hailstorm occurred in Orbost.  The Insurance Council of Australia estimated the 1991 damage at $12 million, with the 2011 estimated normalised cost of $32 million.",1991,-37.70148087,148.45687870,0,0,0,0,"$12,000,000.00",0,0,VIC,http://www.emknowledge.gov.au/resource/?id=429,"$32,000,000.00","$32,000,000.00",$32m
379,Natural,Storm/Hail,"New South Wales, Victoria, Australian Capital Territory, Tasmania and South Australia","At the beginning of February 2005 a low pressure system brought severe storms to eastern Australia. The weather system resulted in record rainfalls to south-east Australia and abnormally low temperatures through much of the eastern half of the country.  New South Wales  On 2 February, many areas of New South Wales and suburban Sydney experienced hail and heavy rain. Some examples are:    Kellyville, hail 5 cm,  Blacktown, hail 4 cm,  Kings Langley, hail 3 cm,  Quakers Hill, hail 3 cm,  Greystanes, heavy rain and hail 4 cm,  Potts Hill, hail 2-3 cm,  Castle Hill, hail 4-5 cm,  Greenacre, hail 4-5 cm,  St Ives, heavy rain and hail 2 cm,  Wahroona, heavy rain and hail 3 cm,  Gosford, hail 4 cm and Terrigal hail 4-5 cm.    Flash flooding was seen in Bexley (metropolitan Sydney) and in North Ryde. A thunderstorm and possible tornado caused severe local wind damage, bringing down trees and power lines, resulting in power outages to thousands of homes.  The strongest wind gusts during the storm were felt at Bathurst with 93 km per hour, Scone 93 km per hour, Kurnell 94 km per hour and Newcastle 91 km per hour.  The unseasonal cold weather brought snow to some areas of New South Wales where approximately 10-15 cm snow fell in the Snowy Mountains and temperatures reached as low as minus 5&deg;C. On the Brindabella Ranges near Canberra and on the Southern Tablelands, several centimetres of snow settled on the ground. Record low maximum and minimum temperatures occurred over this period, especially in the southern areas of the state.  Victoria  Substantial rainfall was reported in many areas of Victoria with 24 hour rainfall totals exceeding 150 mm in many places. Rainfall in the Melbourne metropolitan area exceeded 100 mm with an all time 24 hour record for Melbourne set at 120.2 mm (the previous record was 108 mm).  The highest wind gusts were recorded at Wilson's Promontory with gusts of up to 148 km per hour. In the Melbourne area wind gusts to 104 km per hour were recorded at Fawkner and Beacon.  Extensive damage to buildings was reported and over 7000 requests for assistance were received by the SES and other emergency services over the following days.  Tasmania  During this storm, Tasmania experienced widespread damage particularly from wind gusts. The strong south easterly winds caused damage from Devonport to Bridport, Scottsdale and Winnaleah in the north-east, Binalong Bay on the East Coast, and to Flinders Island in Bass Strait. Port Sorell (near Devonport) reported many homes to be badly damaged in part due to falling trees.  Approximately 25 yachts in the Tamar River broke their moorings, with 14 reportedly destroyed, causing hundreds of thousands of dollars damage.  The Bass Strait ferry Spirit of Tasmania l was forced to return to Melbourne after sustaining damage in seas estimated at 20 m. The Spirit of Tasmania II was delayed on its voyage from Devonport to Melbourne, while the Spirit of Tasmania III broke its moorings in Devonport and was also slightly damaged.  Fruit crops sustained up to 50 per cent loss; particularly apple and pear growers. Damage was also sustained to poppy and grain crops.  Strong winds battered Tasmania during this storm, some examples are; Mount Wellington 104 km per hour, Mount Read 93 km per hour, Eddystone Point 117 km per hour, Flinders Island Airport 100 km per hour, Launceston Airport 94 km per hour and Cape Bruny on Bruny Island 91 km per hour.  On 3 February substantial rainfall accompanied the storm and flooding occurred in several areas on the east coast, some suburbs of Hobart and in the south-east. The Browns River at Kingston broke its banks causing local flooding with several minor landslides also reported in the area.  South Australia  Gale force winds of up to 67 km per hour occurred at several locations in South Australia during this storm event. These occurred in Marree and briefly at Hindmarsh Island.  The Insurance Council of Australia estimated the 2005 damage for the combined states at $216.7 million, with the estimated 2011 normalised cost of $304 million.",2005,-33.71191788,150.95773320,0,0,0,0,"$216,700,000.00",0,0,ACT;NSW;VIC;SA,http://www.emknowledge.gov.au/resource/?id=379,"$304,000,000.00","$304,000,000.00",$304m
69,Natural,Storm/Hail,Ballarat,"On 16 November 1989, a hail storm hit Ballarat resulting in damage to houses and cars.  The Insurance Council of Australia estimated the 1989 damage at $20 million, with the 2011 estimated normalised cost of $81 million.",1989,-37.56158829,143.85623170,0,0,0,0,"$20,000,000.00",0,0,VIC,http://www.emknowledge.gov.au/resource/?id=69,"$81,000,000.00","$81,000,000.00",$81m
35,Natural,Storm/Hail,Sydney Jan 1937,"On 25 January 1937 a severe storm developed near Castle Hill and moved south-east causing damage in the areas of Ryde, Rydalmere, Homebush, Concord, Strathfield, Burwood, Marrickville, Mascot and Botany Bay. Four people died and many were injured as a result of this storm.",1937,-33.87315750,151.20693970,0,0,0,4,$0.00,0,0,NSW,http://www.emknowledge.gov.au/resource/?id=35,"$12,000,000.00",$0.00,Not known
240,Natural,Storm/Hail,Sydney Jan 1947,"On 1 January 1947 at 2.30 pm, a severe hailstorm spread over Sydney, with hail stones reportedly falling in some instances up to 1.8 kg. The hail caused widespread damage to the area.  The storm started in the St. George and Canterbury-Bankstown districts, tracking across Sydney from the south-western suburbs to the eastern suburbs. Many city buildings, such as the Art Gallery and Central Station, sustained extensive damage and more than 300 people were hospitalised.  Suburbs affected include Bankstown, Belmore, Enfield, Rockdale, Bexley North, Punchbowl Hurstville, Marrickville, Stanmore, Enmore, Newtown. Redfern, Mascot, Botany, Waterloo, Paddington, Bondi, Edgecliff, Double Bay, Rose Bay, Vaucluse, Darling Point, Cremorne, Beecroft and the central and southern part of the city.",1947,-33.81110382,151.21307370,0,0,300,0,$0.00,0,0,NSW,http://www.emknowledge.gov.au/resource/?id=240,"$150,000,000.00",$0.00,Not known
150,Natural,Storm/Hail,Kosciuszko NP,"On 7 August 1999, four men in their early twenties were caught in a strong blizzard whilst hiking within Kosciuszko National Park. The men were hiking from Thredbo to Lake Albina for a snowboarding and camping adventure when a severe blizzard developed, forcing them to dig and shelter in a snow cave. It is believed the snow cave was quickly buried in the blizzard, causing the men to be asphyxiated.  The bodies were found 101 days later on 16 November 1999, 2.5 km from where the group had started their trek, at a point not far from Mt Kosciuszko.",1999,-36.33946609,148.57360840,0,0,0,4,$0.00,0,0,NSW,http://www.emknowledge.gov.au/resource/?id=150,"$12,000,000.00",$0.00,Not known
173,Natural,Storm/Hail,Ipswich,"In April 1998 a severe thunderstorm with strong wind gusts reported up to 80 km per hour, swept from New South Wales into Ipswich and other Brisbane suburbs. Strong winds up to 117 km per hour were recorded in Amberley. Three people died when they were electrocuted by a fallen power line. Other damage reported included yachts in the Brisbane to Gladstone yacht race.",1998,-27.61335373,152.75854490,0,0,0,3,$0.00,0,0,QLD,http://www.emknowledge.gov.au/resource/?id=173,"$9,000,000.00",$0.00,Not known
358,Natural,Storm/Hail,South Eastern Australia Nov 1994,"Between 6-8 November 1994, strong land gales up to 145 km per hour lashed Victoria, Australian Capital Territory and New South Wales. One person was killed and another 50 injured. Boats and buildings were damaged and more than 550,000 homes lost power. Huge dust clouds stretched for over thousands of kilometres.  The insurance cost of this event is unknown.",1994,-37.81195450,144.96357730,0,100,50,1,$0.00,0,0,ACT;NSW;VIC,http://www.emknowledge.gov.au/resource/?id=358,"$38,000,000.00",$0.00,Not known
451,Natural,Storm/Hail,Kin Kin,"On 14 August 1971 at Kin Kin, a small area between Noosa and Gympie north of Brisbane, a tornado struck and killed three people and destroyed eight farmhouses and caused considerable damage to a part of the town. The storm descended on the valley 9.30pm on a Saturday night commencing with a hail storm with hail stones the size of cricket balls.  'One resident... 'looked out the window and when the lightning flashed on top of the mountain behind the house, I could see a wall as white as snow. It was about halfway down the mountain. Then the hail came - I have never seen hail so big. Suddenly there was a terrific roar. The house stated to lurch and the lights went out.' The resident and his wife managed to reach the kitchen in the downstairs portion of the house. The next thing he knew was that he was lying in a bath tub which had been blown into the yard amid sheets of roofing iron.' The Gympie Times 17 August 1971.  Relief grants were immediately made available of $500 as announced by the Minister of Works and Housing.",1971,-27.47023964,153.02354430,0,0,0,3,$0.00,0,0,QLD,http://www.emknowledge.gov.au/resource/?id=451,"$9,000,000.00",$0.00,Not known
14,Natural,Storm/Hail,Hunter Valley,"On 31 October 2006 at Hexham in the Hunter Valley, a thunderstorm produced hail 4 cm in diameter. The hail damaged up to 10,000 motor vehicles and stripped leaves off trees.  At Wallsend a thunderstorm produced 4 cm hail, at Kahibah strong winds and 2 cm hail was reported and at New Lambton hail 3-4 cm in diameter was reported. The SES received more than 257 calls for assistance in the Newcastle city area.  The Insurance Council of Australia estimated the 2006 damage at $51 million, with the 2011 estimated normalised cost of $60 million.",2006,-32.82806015,151.68470760,0,0,0,0,"$51,000,000.00",0,0,NSW,http://www.emknowledge.gov.au/resource/?id=14,"$60,000,000.00","$60,000,000.00",$60m
48,Natural,Storm/Hail,"Newcastle, Sydney, Wollongong","In February 1978 severe storms affected Sydney, Newcastle and Wollongong. Wind gusts reached 141 km per hour at Newcastle, causing extensive damage to buildings and the loss of power to many homes. In total eight people were injured as a result of this storm. A tornado accompanied a thunderstorm in the Drummoyne and Hunters Hill areas of Sydney.  The Insurance Council of Australia estimated the 1978 damage at $15 million, with the 2011 estimated normalised cost of $215 million.",1978,-32.92599487,151.77886960,0,0,8,0,"$15,000,000.00",0,0,NSW,http://www.emknowledge.gov.au/resource/?id=48,"$219,000,000.00","$215,000,000.00",$215m
17,Natural,Storm/Hail,New South Wales East Coast Low,"In June 2007 there were five east coast lows off the coast of New South Wales. The first and most severe occurred over 8-9 June. Heavy rain, strong winds and large ocean swells resulted in widespread damage to coastal regions of the Hunter, Central Coast and Sydney Metropolitan areas. The Queen's birthday weekend east coast lows developed in a pre-existing trough of low pressure over the northern Tasman Sea. This trough was directing a humid north-east to south-east air stream across north-east New South Wales and there was a weak low analysed just off the coast near Coffs Harbour on 8 June. The low moved south along the New South Wales coast, before moving out into the Tasman Sea on 10 June 2007.  Thunderstorms caused record breaking flooding in Newcastle, with 164.6 mm of rain falling in 6 hours from 3 pm to 9 pm, causing many shops and businesses to flood and hundreds of cars to be stranded or swept away. This storm event is often associated with the grounding of the Pasha Bulker (a 40,000 tonne bulk carrier ship) which occurred on 8 June on Nobbys Beach in Newcastle and was not re-floated until 2 July. Approximately 6000 people were evacuated from Maitland (near Newcastle) when it was considered that a levee may have burst.  In the Hunter Valley it was reported as the worst flooding in 52 years. Major flooding in the Hunter River occurred from 8 to 13 June and in the Paterson and Williams River from the 8 to 9 June. Moderate flooding occurred in the Wyong, Colo and Nepean Rivers.  Ferry services were cancelled on Sydney Harbour due to the weather conditions. The Cremorne wharf collapsed and sank due to large ocean swells. Beaches were eroded at many Sydney locations, due to swells up to 14 metres high. High winds blew beach sand over 100 metres inland. Over 200,000 homes reportedly lost power in the Sydney - Newcastle area due to flooding and high winds. Many thousands of homes and businesses lost telephone services when telephone exchanges were flooded.  A natural disaster was declared in the Hunter Valley and the Central Coast areas. There were a total of nine fatalities associated with the storm. Nearly 20,000 calls for assistance were made to the State Emergency Service.  The Insurance Council of Australia estimated the 2007 damage at $1480 million, with the 2011 estimated normalised cost of $1742 million.",2007,-32.92599487,151.77886960,6000,0,0,9,"$1,480,000,000.00",0,0,NSW,http://www.emknowledge.gov.au/resource/?id=17,"$2,369,000,000.00","$1,742,000,000.00","$1,742m"
23,Natural,Storm/Hail,Lismore,"On 8 October 2007 a super-cell thunderstorm with large hailstones the size of tennis balls hit Lismore at 1.50 pm causing chaos in the central business district. There was extensive damage to central Lismore as a result of the large hail and strong winds. South Lismore was hit again on 9 October by hail 6 cm in diameter and strong winds estimated at 100 km per hour, which caused widespread damage. Approximately 20 mm rain fell in 10 minutes. Seventeen people were injured by hail or flying glass from smashed windows. Homes and motor vehicles were damaged, trees were uprooted by flash flooding and there were many power outages. Buildings were damaged including City Hall, the police station, ambulance station, hospital and other council buildings as well as small businesses.  There were approximately 300 calls for assistance received by the SES.  The Insurance Council of Australia estimated the 2006 damage at $97 million, with the 2011 estimated normalised cost of $109 million.",2007,-28.80650711,153.27694700,0,0,17,0,"$97,000,000.00",0,0,NSW,http://www.emknowledge.gov.au/resource/?id=23,"$117,500,000.00","$109,000,000.00",$109m
28,Natural,Storm/Hail,Orange,"On 21 January 1986 a severe hailstorm caused extensive damage to homes, farms and crops in the Orange area of the Central Tablelands. Hail of up to 7 cm in diameter was reported and over 100 motor vehicles were damaged. The Insurance Council of Australia estimated the 1986 damage at $25 million, with the 2011 estimated normalised cost of $160 million.",1986,-33.28357697,149.10127260,0,0,0,0,"$25,000,000.00",0,0,NSW,http://www.emknowledge.gov.au/resource/?id=28,"$160,000,000.00","$160,000,000.00",$160m
32,Natural,Storm/Hail,"Hunter Valley, Tablelands and Southern Highlands","On 23 June 1998, severe storms with gale force winds affected the Northern tablelands and Hunter Valley regions of Sydney, causing damage to properties and infrastructure. Fallen power lines created a power outage for over 7000 homes and demand for power reached record levels on the night of 23 June.  The State Emergency Service reported that across the State more than 2000 requests for assistance had been received; almost 1800 of which were received from the Hunter Valley. The worst affected areas were Lake Macquarie, Maitland, Newcastle and Port Stephens.  One woman drowned in flooded waters at Crookwell.  The Insurance Council of Australia estimated the 1998 damage at $12 million, with the 2011 estimated normalised cost of $39 million.&lt;",1998,-32.73263550,151.55793760,0,0,0,1,"$12,000,000.00",0,0,NSW,http://www.emknowledge.gov.au/resource/?id=32,"$42,000,000.00","$39,000,000.00",$39m
34,Natural,Storm/Hail,Western Sydney,"On 18 March 1990, a hailstorm spread from Camden south-west of Sydney to Narrabeen Beach on Sydney's northern region. The hail measured up to 8 cm and caused severe damage to approximately 14,000 homes and businesses and 9000 motor vehicles. Winds reached 109 km per hour at Bankstown. Nine kilometres of power lines were brought down and roads were closed from flash flooding. The State Emergency Service received more than 3500 calls for help in the first two days after the storm with assistance being provided to approximately 2000 homes. Twenty-five people sustained serious injury.  The Insurance Council of Australia estimated the 1999 damage at $319 million, with the 2011 estimated normalised cost of $1297 million.",1990,-33.91615677,151.03575130,0,100,25,0,"$319,000,000.00",0,0,NSW,http://www.emknowledge.gov.au/resource/?id=34,"$1,319,500,000.00","$1,297,000,000.00","$1,297m"
192,Natural,Storm/Hail,Singleton,"In the afternoon of 11 December 1996, Singleton in the upper Hunter Valley experienced a severe storm. Hailstones as large as 7 cm penetrated roofs and smashed windows for a period up to fifteen minutes exposing houses to flooding from subsequent large downpours of rain. The storm damaged 700 houses in Singleton and surrounding areas. Approximately 2000 vehicles were seriously damaged and more than 50 cars written off completely.  Damage also occurred to crops; grape, barley, lucerne and other market garden enterprises.  The Insurance Council of Australia estimated the 1996 damage at $49 million, with the 2011 estimated normalised cost of $149 million.",1996,-32.56196976,151.17532350,0,0,0,0,"$49,000,000.00",700,0,NSW,http://www.emknowledge.gov.au/resource/?id=192,"$149,000,000.00","$149,000,000.00",$149m
59,Natural,Storm/Hail,Nyngan,"On 5 January 1998 at 3.15pm, a severe storm with hail and strong winds struck the western New South Wales town of Nyngan. Damage to property included four houses destroyed and 77 houses sustaining significant damage. Public buildings, schools and shops were also damaged. There was widespread damage to infrastructure including electricity lines, water and sewage. One person was injured.  The Insurance Council of Australia estimated the 1998 damage at $12 million, with the 2011 estimated normalised cost of $27 million.",1998,-31.53523827,147.19207760,0,0,1,0,"$12,000,000.00",77,4,NSW,http://www.emknowledge.gov.au/resource/?id=59,"$27,500,000.00","$27,000,000.00",$27m
88,Natural,Storm/Hail,Sydney and Region 2001,"On 15 January 2001, maximum temperatures reached 46 &deg;C degrees at the Sydney suburb of Penrith before a cool change moved through with accompanying wind gusts up to 113 km per hour. The wind impacted Sydney's metropolitan area, and caused considerable damage to property, trees and fences and thousands of homes lost electricity.  Affected regions of New South Wales were declared natural disaster areas. Residents from the regions of Shoalhaven to Sydney and the Lower Hunter met the criteria for emergency government assistance.  The Insurance Council of Australia estimated the 2001 damage at $12 million, with the 2011 estimated normalised cost of $24 million.",2001,-33.84646606,151.23075870,0,0,0,0,"$12,000,000.00",0,0,NSW,http://www.emknowledge.gov.au/resource/?id=88,"$24,000,000.00","$24,000,000.00",$24m
93,Natural,Storm/Hail,Brisbane and South East Queensland,"Severe hail storms were recorded during the period 3 - 6 November 1995 in south-east Queensland. Large hail caused extensive damage to over 300 homes and many cars in Brisbane. One person died when a small boat was struck by lightning on Moreton Bay.  Many trees and powerlines fell causing widespread blackouts to approximately 100,000 homes. Large hail brought destruction to fruit, vegetable and grain crops, particularly in the Granite Belt region. Other areas seriously affected included Beenleigh and Beaudesert.  The Insurance Council of Australia estimated the 1995 damage at $40 million, with the 2011 estimated normalised cost of $166 million.",1995,-27.47093391,153.02349850,0,0,0,1,"$40,000,000.00",300,0,QLD,http://www.emknowledge.gov.au/resource/?id=93,"$169,000,000.00","$166,000,000.00",$166m
118,Natural,Storm/Hail,Illawarra and Sydney,"On the 31 August 1996, an East Coast Low created a storm that was considered one of the most serious in the decade. Widespread damage from heavy rain and strong wind occurred, reaching storm force (averaging above 89 km per hour and peaking at 119 km per hour at Bellambi Point. Wind gusts in excess of 93 km per hour were recorded at Norah Head, Fort Denison, Sydney Airport and Wollongong.  The main Illawarra/South Coast rail line was cut, and rainfall totalled 386 mm at Darkes Forest, while Wollongong and Robertson both recorded 122 mm in 24 hours.  The Insurance Council of Australia estimated the 1996 damage at $10 million, with the 2011 estimated normalised cost of $30 million.",1996,-34.23423004,150.91918950,0,0,0,0,"$10,000,000.00",0,0,NSW,http://www.emknowledge.gov.au/resource/?id=118,"$30,000,000.00","$30,000,000.00",$30m
219,Natural,Storm/Hail,Western Sydney,"On 3 October 1986 a severe hailstorm spread over Western Sydney. Hail stones of up to 6 cm caused damage to hundreds of homes and ten people sustained injury.  The Insurance Council of Australia estimated the 1999 damage at $104 million, with the 2011 estimated normalised cost of $638 million.",1986,-33.81459808,151.00312810,0,120,10,0,"$104,000,000.00",0,0,NSW,http://www.emknowledge.gov.au/resource/?id=219,"$655,000,000.00","$638,000,000.00",$638m
136,Natural,Storm/Hail,"Sydney, Hunter Valley and Northern Regions","On 3 December 2001, severe thunderstorms hit a wide area of New South Wales with the most impact occurring in Sydney. A storm event moving at 80-100 km per hour produced a wind gust of 174 km per hour at the north western suburb of Richmond, which set a record as the highest wind gust ever recorded in mainland New South Wales. Other significant squalls were recorded,109 km per hour at Kurnell, 102 km per hour at Hornsby and at Gunnedah (north-west slopes) wind gusts of 137 km per hour caused damage to trees and buildings. Hail estimated to be 3 cm in diameter was reported at Pymble and 2 cm in diameter was also reported at Swansea in the Hunter Valley.  Two people died when a branch of a tree fell on their tent at Crosslands Reserve, Hornsby Heights, North Sydney.  The Insurance Council of Australia estimated the 2001 damage at $30 million, with the 2011 estimated normalised cost of $57 million.",2001,-33.59631729,150.75697330,0,0,0,2,"$30,000,000.00",0,0,NSW,http://www.emknowledge.gov.au/resource/?id=136,"$63,000,000.00","$57,000,000.00",$57m
