id,type,sub_type,name,description,year,lat,long,evacuated,homeless,injuries,deaths,insured_cost,homes_damaged,homes_destroyed,regions,url,severity,normalised_cost_2011,cost_2011_text
180,Natural,Storm/Hail,Toowoomba,"A severe storm caused extreme weather conditions in the Toowoomba region on 9 January 1976. Gale force winds combined with large hail produced widespread damage to infrastructure, buildings and houses.  The Insurance Council of Australia estimated the 1976 damage at $12 million, with the 2011 estimated normalised cost of $282 million.",1976,-27.56375313,151.95405580,0,0,0,0,"$12,000,000.00",0,0,QLD,http://www.emknowledge.gov.au/resource/?id=180,"$282,000,000.00","$282,000,000.00",$282m
188,Natural,Storm/Hail,Adelaide,"On 6 December 1986 two severe storms occurred over Adelaide and region with strong winds heavy and rain. Most damage was caused by wind and there was some flooding reported. Some areas in Adelaide Hills and the Far-North of the state were flooded.  The Insurance Council of Australia estimated the 1986 damage at $10 million, with the 2011 estimated normalised cost of $50 million.",1986,-34.92745972,138.59999080,0,50,0,0,"$10,000,000.00",0,0,SA,http://www.emknowledge.gov.au/resource/?id=188,"$55,000,000.00","$50,000,000.00",$50m
213,Natural,Storm/Hail,Sydney Apr 1999,"At approximately 7.45 pm on 14 April 1999, a torrential hailstorm hit Sydney's inner and eastern suburbs, damaging thousands of homes and cars. Hailstones the size of cricket balls hit the city at more than 200 km per hour. The storm hit 85 suburbs, causing damage to 20,000 houses including windows, roofs and skylights. Seventy thousand cars sustained windscreen and panel damage. The worst affected areas included the south-east suburbs of Kensington, Kingsford, Botany, Mascot, Randwick and Paddington. One person died as a result of the storm.  The Insurance Council of Australia estimated the 1999 damage at $1700 million, with the 2011 estimated normalised cost of $4296 million.",1999,-33.90967560,151.22302250,0,500,50,1,"$1,700,000,000.00",20000,0,NSW,http://www.emknowledge.gov.au/resource/?id=213,"$4,374,000,000.00","$4,296,000,000.00","$4,296m"
280,Natural,Storm/Hail,Brisbane and Region,"On 16 December 1998, a severe storm crossed Brisbane suburbs causing extensive hail damage. The most affected suburbs were Clayfield, Windsor, Wilston, Albion, Northgate and Wavell Heights.  The Insurance Council of Australia estimated the 1998 damage at $76 million, with the 2011 estimated normalised cost of $254 million.",1998,-27.41870308,153.05532840,0,0,0,0,"$76,000,000.00",2600,0,QLD,http://www.emknowledge.gov.au/resource/?id=280,"$254,000,000.00","$254,000,000.00",$254m
302,Natural,Storm/Hail,Sydney and Blue Mountains,"A severe storm moved across the Blue Mountains and into Sydney, northern suburbs and beaches on the 20 November 1994 resulting in considerable damage. Trees were uprooted, houses and cars damaged, powerlines fell and some buildings collapsed. Thousands of houses lost power. Two injuries reportedly occurred during the storm and two people drowned on the Harbour in strong winds when their sailing skiff capsized. The storm moved into western Sydney and while the impact was not as severe as in the north, power was lost to thousands of homes and rail services were cut in some areas.  Property damage was also reported from rural areas including Narromine and Dubbo where wind gusts were recorded up to 139 km per hour.  The Insurance Council of Australia estimated the 1994 damage at $29 million, with the 2011 estimated normalised cost of $100 million.",1994,-33.91601181,150.99227910,0,0,2,2,"$29,000,000.00",0,0,NSW,http://www.emknowledge.gov.au/resource/?id=302,"$107,000,000.00","$100,000,000.00",$100m
304,Natural,Storm/Hail,"Perth, Mandurah and South-West Coast","On 23 and 24 May 1994, Perth, Mandurah and south-western Western Australia experienced strong land gales gusting up to 140 km per hour. Several houses were completely unroofed and damage occurred to approximately 600 houses with different levels of severity. Damage to electricity infrastructure resulted in widespread loss of power to the Perth area lasting up to a week in some instances. Substantial financial losses were incurred by commerce and industry.  Huge seas and tides caused significant erosion to beaches, and parts of the Perth river foreshore were inundated. Fremantle recorded 25 wind gusts of at least 129 km per hour, more than three times the number recorded for any other event since the 1960s.  The Insurance Council of Australia estimated the 1994 damage at $37 million, with the 2011 estimated normalised cost of $187 million.",1994,-32.53684616,115.74227140,0,200,0,0,"$37,000,000.00",0,0,WA,http://www.emknowledge.gov.au/resource/?id=304,"$207,000,000.00","$187,000,000.00",$187m
313,Natural,Storm/Hail,Sydney and Region 1998,"On 4 February 1998, a thunderstorm with approximately 16,000 lightning strikes struck Sydney and regional areas. In Sydney 40,000 homes were without power. In regional areas there were several reports of severe wind gusts during the afternoon. The highest were: 106 km per hour at Dubbo, 104 km per hour at Coonamble, 83 km per hour at Orange and 76 km per hour at Armidale.  The Insurance Council of Australia estimated the 1998 damage at $12 million, with the 2011 estimated normalised cost of $34 million.",1998,-34.84997940,150.74653630,0,0,1,0,"$12,000,000.00",0,0,NSW,http://www.emknowledge.gov.au/resource/?id=313,"$34,500,000.00","$34,000,000.00",$34m
319,Natural,Storm/Hail,"Sydney, Wollongong and South Coast","On 24 October 1999, severe thunderstorms affected the mid-north coast and northern rivers districts of New South Wales. Twenty three yachts on Sydney Harbour were damaged and lightning cut power across parts of Sydney. Strong winds brought down trees in many Sydney suburbs. At Kendall in the mid-north coast, 5.5 cm diameter hail was reported. It dented cars, broke windows and skylights, and destroyed gardens. The Illawarra Escarpment received the heaviest rainfall in this event with Wattamolla (Tamol) recording 340 mm over two days.  The Insurance Council of Australia estimated the 1999 damage at $45 million, with the 2011 estimated normalised cost of $100 million.",1999,-31.63124084,152.70387270,0,0,0,0,"$5,000,000.00",0,0,NSW,http://www.emknowledge.gov.au/resource/?id=319,"$11,000,000.00","$11,000,000.00",$11m
340,Natural,Storm/Hail,Sydney Jan 1991,"A severe thunderstorm caused serious damage to parts of north-west Sydney with a weather pattern suggesting it may have been caused by a tornado or at least a severe 'downburst' in the Turramurra area. The storm hit at around 4pm 21 January 1991 and moved out to sea at approximately 5.15pm.  Estimated wind strengths (based on damage) of 118 km per hour to 230 km per hour brought down many trees (at least 50,000 significant trees were felled or suffered long-term damage). Falling trees damaged over 10,000 houses, with over 100 completely unroofed and 20 totally destroyed. At least 1000 other buildings incurred damage and many businesses suffered extensive damage. About 140 km of power lines and three steel towers were brought down. (Clean up and restoration of essential services took weeks).  Worst hit were the northern suburbs of Turramurra, Lindfield and Wahroonga, while in the west, Seven Hills, Blacktown, Parramatta, Castle Hill, Wollondilly and Dural reported extensive storm damage. The Insurance Council of Australia estimated the 1991 damage at $138.4 million, with the 2011 estimated normalised cost of $525 million.",1991,-33.87315750,151.20693970,0,0,100,1,"$138,400,000.00",10000,20,NSW,http://www.emknowledge.gov.au/resource/?id=340,"$578,000,000.00","$525,000,000.00",$525m
354,Natural,Storm/Hail,Casino and Region,"On 17 January 2001, north-eastern New South Wales experienced a severe thunderstorm, with the worst impact occurring in the town of Casino. Heavy rain caused local flash flooding. Approximately 59 mm of rain was recorded including 31 mm in just ten minutes. Hailstones up to 7 cm were reported in some areas. Gale force winds in some instances exceeding 110 km per hour inflicted damage to 800 homes and 300 motor vehicles. Power lines fell, cutting power to the town. It is estimated that 30,000 properties lost power in the region as a result of the storm.  The Insurance Council of Australia estimated the 2001 damage at $35 million, with the 2011 estimated normalised cost of $65 million.",2001,-28.86076164,153.04589840,0,0,0,0,"$35,000,000.00",800,0,NSW,http://www.emknowledge.gov.au/resource/?id=354,"$65,000,000.00","$65,000,000.00",$65m
376,Natural,Storm/Hail,South Eastern Australia,"On 24 August 2003, a windstorm developed from an intense low pressure system over Tasmania and was felt along the eastern states from Victoria to New South Wales.  Tasmania  Tasmanian police removed trees blown on to roads by the strong winds on the Murchison Highway in Roseberry on the west coast, and a tree was moved off the Tasman Highway in Buckland on the east coast . Falling trees across power lines cut electricity to the Tasman Peninsula between Sorell and Nubeena.  Rain caused flooding over an extensive area of southern Tasmania and damaged the Buckland Bridge in Orford, which connects the east coast to the Midlands, to the point where it had to be closed for two days.  Police received approximately 400 calls for assistance, the majority from people in the Tasman Peninsula, Bruny Island, the Huon Valley and the east coast.  New South Wales  Sydney and Illawarra districts experienced gale force winds causing considerable damage to trees, boats, aircraft, buildings and power loss to 150,000 homes. Wind gusts reached 141 km per hour at Bellambi Point, 120 km per hour at Albion Park, Manly and Kurnell, 113 km per hour at Sydney Airport and 109 km per hour at Fort Denison. A man died when a tree fell on his car in St Ives. Three people were injured by falling trees in Mosman and Bathurst and another after falling from a roof in Wollongong. Two swimmers were apparently lost when they were blown out to sea off Curl Curl.  Australian Capital Territory  In Canberra strong winds tore roof tiles off houses, uprooted trees and brought down power lines. Canberra Airport reported a maximum wind gust of 93 km per hour.  Victoria  Heavy rain and strong winds caused trees to fall damaging several houses and cutting off major roads across Melbourne and in the north-east of the state, with the State Emergency Service responding to more than 1,500 calls for help.  Maximum wind gusts recorded on 24 August included 90 km per hour at Gelantipy, 91 km per hour at Cape Nelson, 93 km per hour at Mt Buller, 94 km per hour at Aireys Inlet, Cape Otway, Cerberus, Combienbar, Fawkner Beacon and Lookout Hill, 98 km per hour at Dunns Hill, Frankston and Mt Gellibrand. Wind damage occurred around Melbourne and in southern Victoria.  The Insurance Council of Australia estimated the 2003 damage at $25 million, with the 2011 estimated normalised cost of $39 million.",2003,-37.81195450,144.96357730,0,0,4,1,"$25,000,000.00",0,0,ACT;NSW;VIC;TAS,http://www.emknowledge.gov.au/resource/?id=376,"$44,000,000.00","$39,000,000.00",$39m
377,Natural,Storm/Hail,South-East Queensland,"From 24 to 26 January 2004, a ridge of high pressure extended south of Tasmania over to New Zealand. This placed Brisbane in a hot humid north to north westerly air stream for the week. These conditions produced a succession of severe thunderstorms causing widespread damage in south-east Queensland, particularly in Brisbane, Ipswich and the Gold and Sunshine Coasts. Towns affected included Currumbin, Coolangatta, Fortitude Valley, Woolloongabba, Oxley, Coorparoo, Warrick, Ipswich, Bundamba, Bellbowrie, Calliope, Jimboomba, Beaudesert, Gatton, Nanango, Archerfield, Toowoomba, Kawana Waters, Caloundra, Morerton Bay, Maryborough and Rockhampton.  The Amberley Royal Australian Air Force base recorded a wind gust of 111 km per hour and a sustained wind of 100 km per hour for a 10 minute period. Severe wind combined with large hailstorms caused widespread damage and houses were affected by fallen trees and debris. Furthermore, there was damage to infrastructure and 121,000 houses in the Brisbane area lost power.  The Insurance Council of Australia estimated the 2004 damage at $28.5 million, with the 2011 estimated normalised cost of $54 million.",2004,-28.13527489,153.48655700,0,0,3,1,"$28,500,000.00",0,0,QLD,http://www.emknowledge.gov.au/resource/?id=377,"$58,500,000.00","$54,000,000.00",$54m
428,Natural,Storm/Hail,Sydney Apr 1998,"Thunderstorms coupled with heavy rain occurred in the Sydney metropolitan area late 9 Apri 1998 and into the following day. Much of the reported damage was due to flash flooding. Hundreds of SES staff and volunteers worked to protect homes around the Narrabeen Lake area as water levels rose to a 15 year high. Three houses were evacuated as they were threatened by stormwater at the rear of their properties. Approximately 5,000 homes lost power after the heavy rains. One person drowned after being swept away in a swollen creek. Avalon and Belrose recorded rainfall levels in excess of 200 mm.  The Bureau of Meteorology advised the event was caused by an upper level system interacting with warm, moist onshore flow lifted by a trough off the coast.  The Insurance Council of Australia estimated the 1998 damage at $10 million, with the 2011 estimated normalised cost of $28 million.",1998,-33.91579819,151.03575130,0,0,0,1,"$10,000,000.00",80,0,NSW,http://www.emknowledge.gov.au/resource/?id=428,"$31,000,000.00","$28,000,000.00",$28m
384,Natural,Storm/Hail,Sydney Feb 2002,"A severe storm crossed the western suburbs of Sydney late in the afternoon of 16 February 2002 causing considerable damage. It moved in a north north-easterly direction at a speed of about 30 km per hour with very heavy rain and strong wind gusts. The strongest wind gust reported was 96 km per hour at Bankstown Airport. The SES received approximately 8000 requests for assistance. The Insurance Council of Australia estimated the 2002 damage at $10 million, with the 2011 estimated normalised cost of $19 million.",2002,-33.71273804,151.29684450,0,0,0,0,"$10,000,000.00",0,0,NSW,http://www.emknowledge.gov.au/resource/?id=384,"$19,000,000.00","$19,000,000.00",$19m
398,Natural,Storm/Hail,Bunbury and South Perth,"On 16 May 2005, a strong cold front caused widespread damage to Perth suburbs and parts of the south-west of the state. Several tornadoes occurred on the edge of the front causing serious damage to buildings and houses in the Bicton and Bunbury areas.  The Fire and Emergency Services Authority (FESA) described it as the worst storm in ten years. The SES received over 800 calls for assistance. Five schools were damaged and at Bicton Primary School the music room was ripped from its foundation.  In Bunbury the tornado caused substantial damage to buildings and residences. Heavy rain caused extensive flooding and traffic chaos with roads closed, including a main highway. Some parts of the south-west recorded up to 80 mm of rain in 24 hours.  In excess of 100,000 customers were left without power and the city was littered with downed power poles and live wires. Power was cut along the storm's path in areas such as Bicton, Fremantle, Canningvale, Kwinana and Armadale.  The Insurance Council of Australia estimated the 2005 damage at $53.2 million, with the 2011 normalised cost at $108 million.",2005,-32.02743530,115.78224950,0,0,0,0,"$53,200,000.00",0,0,WA,http://www.emknowledge.gov.au/resource/?id=398,"$108,000,000.00","$108,000,000.00",$108m
399,Natural,Storm/Hail,Brisbane,"A hailstorm brought about by unusual weather conditions created widespread flooding and significant damage to the city of Brisbane. The cause of the extreme weather was a vast difference between the ground temperature and a below freezing stratosphere temperature, combined with damp air situated on the coast.  Hail was reported as being 15 cm deep across roads in some areas. There was significant damage to buildings and cars. Over 200 lightning strikes were recorded and as a result Brisbane Airport was required to close for an hour until the storm subsided. Approximately 6500 properties lost power and the SES responded to 160 calls, caused by flooding waters, fallen power lines and trees.  The Insurance Council of Australia estimated the 2005 damage at $17.6 million, with the 2011 estimated normalised cost of $28 million.",2005,-27.47093391,153.02349850,0,0,0,0,"$17,600,000.00",0,0,QLD,http://www.emknowledge.gov.au/resource/?id=399,"$28,000,000.00","$28,000,000.00",$28m
402,Natural,Storm/Hail,Gold Coast,"On 12 October 2005, a severe thunderstorm caused a hailstorm in the Gold and Sunshine Coasts. In some regions of Queensland hailstones of up to 7 cm in diameter were reported. The major suburbs and towns affected include Helensvale, Oxenford, Coomera, Mt Nathan, Gaven, Pacific Pines, Arundel, Coombabah, Toowoomba, Gatton, Laidley and Esk.  State Emergency Service crews responded to more than 724 calls for help as the hailstorm damage spread to houses, buildings and cars. Approximately 2000 motor vehicles and 500 homes were damaged.  The Insurance Council of Australia estimated the 2005 damage at $61 million, with the 2011 estimated normalised cost of $89 million.",2005,-27.92241287,153.33787540,0,0,0,0,"$61,000,000.00",0,500,QLD,http://www.emknowledge.gov.au/resource/?id=402,"$89,000,000.00","$89,000,000.00",$89m
415,Natural,Storm/Hail,Sydney Jan 1977,"On 21 January 1977 severe thunderstorms spread over New South Wales, affecting mainly the Sydney regions of Bankstown and Richmond. Winds reached 124 km per hour and there was one fatality.  The Insurance Council of Australia estimated the 1977 damage at $15 million, with the 2011 estimated normalised cost of $244 million.",1977,-33.80190277,150.94416810,0,0,0,1,"$15,000,000.00",0,0,NSW,http://www.emknowledge.gov.au/resource/?id=415,"$247,000,000.00","$244,000,000.00",$244m
446,Natural,Storm/Hail,Warwick,"On 13 October 1998 severe thunderstorms occurred in the area of Warwick. The impact of the storm included damage to 12 homes, commercial buildings, trees uprooted, and significant crop damage.  Later the same day storms occurred in the Brisbane area causing widespread damage to houses, buildings and trees being uprooted. Inner city rail services ceased operation for several hours. Brisbane Airport recorded significant wind gusts of up to 119 km per hour. Hail the size of golf balls were reported in the Brisbane and Gympie areas.  The Insurance Council of Australia estimated the 1998 damage at $23 million, with the 2011 estimated normalised cost of $80 million.",1998,-33.91352081,150.93167110,0,0,0,0,"$23,000,000.00",12,0,QLD,http://www.emknowledge.gov.au/resource/?id=446,"$80,000,000.00","$80,000,000.00",$80m
452,Natural,Storm/Hail,Sydney Feb 1992,"On 12 February 1992, hail stones measuring up to 7.5 cm fell in western suburbs of Girraween and Toongabbie, Sydney. Approximately 3000 homes and 7000 vehicles were damaged.  In addition, the State was ravaged by a series of severe storms including flash floods and hail which damaged homes and other buildings along the coast including Sydney and Newcastle.  The Insurance Council of Australia estimated the 1992 damage at $118 million, with the 2011 estimated normalised cost of $441 million.",1992,-33.73226166,151.12783810,0,0,1,0,"$118,000,000.00",3000,0,NSW,http://www.emknowledge.gov.au/resource/?id=452,"$441,500,000.00","$441,000,000.00",$441m
471,Natural,Storm/Hail,Brighton,"A severe storm caused hail damage in northern Brisbane, Bracken Ridge, and extensive damage to 5000 homes in Brighton.  The Insurance Council of Australia estimated the 1980 damage at $15 million, with the 2011 estimated normalised cost of $238 million.",1980,-27.30474854,153.06268310,0,0,0,0,"$15,000,000.00",5000,0,QLD,http://www.emknowledge.gov.au/resource/?id=471,"$238,000,000.00","$238,000,000.00",$238m
472,Natural,Storm/Hail,Armidale and Tamworth,"On 29 September 1996, a hail storm approached the city of Armidale from the west-south-west measuring 2 km wide and 15 km long.  Hail stones fell measuring up to 80 mm in diameter and southerly winds were recorded up to 160 km per hour at the Armidale Airport weather station. The area was declared a disaster zone. 5000 buildings and homes, and 4000 motor vehicles were damaged. State Emergency Service crews were brought in from across the state to assist. Ten people sustained serious injury.  The Insurance Council of Australia estimated the 1996 damage at $104 million, with the 2011 estimated normalised cost of $288 million.",1996,-30.51434326,151.66696170,0,0,10,0,"$104,000,000.00",0,0,NSW,http://www.emknowledge.gov.au/resource/?id=472,"$293,000,000.00","$288,000,000.00",$288m
491,Natural,Storm/Hail,South-East Queensland Nov 2008,"Between 16 and 22 November 2008 heavy rains and subsequent flooding affected the Brisbane region and surrounding areas. A surface trough developed through inland Queensland and combined with an upper level trough system to deliver severe thunderstorms and flood rainfall across parts of south-east Queensland. The system affected multiple towns including Ipswich, Lockyer Valley, Bundamba, Tallagalla, Forest Hill and Ebbw Vale.  The heavy deluge produced significant rainfall over the catchment areas, which resulted in rapid river rises and consequent flooding. There was widespread damage to infrastructure including roads, railway lines and bridges as well as buildings and houses. Furthermore, many vehicles were damaged due to the rapid rise in rivers and creeks.  A person died when their car was swept away by floodwaters at a crossing on Laidley Creek at Forest Hill near Gatton.  The Insurance Council of Australia estimated the 2008 damage at $309 million, with the 2011 estimated normalised cost of $355 million.",2008,-27.61308670,152.75819400,0,0,0,1,"$309,000,000.00",0,0,QLD,http://www.emknowledge.gov.au/resource/?id=491,"$358,000,000.00","$355,000,000.00",$355m
493,Natural,Storm/Hail,Southern States Windstorms,"Victoria  On 2 April 2008 very strong northerly winds developed across central and western Victoria. Maximum wind gusts in Victoria were recorded at Mt Gellibrand at 131 km per hour, Dunns Hill in the Dandenongs at 115 km per hour and Melbourne Airport 107 km per hour.  Areas of raised dust were reported from the western half of the state, with visibility down to 200 m in some places.  The heaviest rainfall totals were from Falls Creek (Rocky Valley Dam) with 50 mm and Wilsons Promontory with 26 mm. The storm sent vegetation and debris flying, caused major disruption to Melbourne traffic and public transport systems and extensive damage to the electricity distribution network. Lanes were closed on the Westgate bridge where wind gusts were close to 120 km per hour, many traffic lights were out and conditions on the roads were chaotic. Several boats were washed ashore at Mornington, where large waves were observed.  There were reports that two people died as a result of this storm in Victoria.  More than 9,500 requests for assistance were received by emergency service agencies across the State between 2-7 April 2008 as a result of this event.  The Department of Human Services (DHS) coordinated Red Cross and local government to support the community with recovery, distributing 864 personal hardship grants totalling $240,115.  South Australia  An intense low on 2 April produced widespread wind gusts in excess of 90 km per hour across the Mount Lofty Ranges, Kangaroo Island and the South East districts of South Australia.  Tasmania  A deep low pressure system passed close to Tasmania bringing destructive winds from late 2nd April until early the next day with individual wind gusts well over 100 km per hour recorded at several locations. More than 40,000 premises lost power with at least 200 fallen power lines caused road closures. Many buildings lost their roofs. The pressure at Maatsuyker Island dipped to 966.2 hPa on 3 April the second lowest mean sea level pressure ever reported in Tasmania. Strong and gusty winds on 2 April caused a dust storm in the southern Midlands.  The estimated damage bill was around two million dollars.  The Insurance Council of Australia estimated the 2008 damage at $65 million across the three states, with the 2011 estimated normalised cost of $79 million.",2008,-38.22995377,143.80073550,0,0,0,2,"$65,000,000.00",0,0,TAS;SA;VIC,http://www.emknowledge.gov.au/resource/?id=493,"$85,000,000.00","$79,000,000.00",$79m
500,Natural,Storm/Hail,Sydney Dec 2007,"On 9 December 2007 in the north-west suburbs of Sydney a severe thunderstorm with strong winds and hail caused widespread damage from Blacktown to Wahroonga. The largest confirmed hail size was 7 cm at Blacktown and 6 cm at Wahroonga with an unconfirmed report of 11 cm hail at Cherrybrook.  On the Central Coast, a thunderstorm with very heavy rain and strong winds was reported. Wind gusts reached 85 km per hour at Mangrove Mountain. At Terrigal 36 mm of rain and 30 mm at Newcastle was recorded within 30 minutes. At Mount Seaview there were thunderstorms all day with heavy rain up to 81 mm from 9.00 am to 8.00 pm.  Approximately 20,000 homes lost power and there were more than 6000 calls for assistance received by the SES. Trees were uprooted and houses and motor vehicles were damaged. More than 30 people were treated for cuts and bruises from the storm.  The Insurance Council of Australia estimated the 2007 damage at $415 million, with the 2011 estimated normalised cost of $486 million.",2007,-33.91594315,151.03565980,0,0,30,0,"$415,000,000.00",0,0,NSW,http://www.emknowledge.gov.au/resource/?id=500,"$501,000,000.00","$486,000,000.00",$486m
